title,description,category,type,creator_s,collection,related_resource,url,logo,featured_image,filename
breakerofchains,"This package enables you to see output at various points in your pipeline (%>%). 
",Data Wrangling,Package,Miles McBain,,"dplyr,tidyverse,tidylog,tidyr",https://github.com/MilesMcBain/breakerofchains,,https://raw.githubusercontent.com/rfortherestofus/rru-website/master/plots/breakerofchains.png,plots/breakerofchains.png
dplyr,"dplyr is a grammar of data manipulation, providing a consistent set of verbs that help you solve the most common data manipulation challenges. It is one of the core tidyverse packges.",Data Wrangling,Package,"Hadley Wickham,Romain François,Lionel Henry,Kirill Müller",,tidyverse,https://dplyr.tidyverse.org/,https://github.com/tidyverse/dplyr/raw/master/man/figures/logo.png,https://raw.githubusercontent.com/rfortherestofus/rru-website/master/plots/dplyr.png,plots/dplyr.png
purrr,"The purrr package is focused on iteration. You can use it to do things like read in multiple sheets from an Excel spreadsheet into a single data frame, knit an RMarkdown to multiple reports, etc.
",Data Wrangling,Package,"Lionel Henry,Hadley Wickham,RStudio",,,https://purrr.tidyverse.org/,https://github.com/tidyverse/purrr/raw/master/man/figures/logo.png,https://raw.githubusercontent.com/rfortherestofus/rru-website/master/plots/purrr.png,plots/purrr.png
tidylog,"Tidylog provides feedback about dplyr and tidyr operations. It provides wrapper functions for the most common functions, such as filter, mutate, select, and group_by, and provides detailed output for joins.",Data Wrangling,Package,Benjamin Elbers,,"dplyr,tidyverse,breakerofchains,tidyr",https://github.com/elbersb/tidylog,,https://raw.githubusercontent.com/rfortherestofus/rru-website/master/plots/tidylog.png,plots/tidylog.png
ViewPipeSteps,This RStudio add-in enables you to see results of your pipeline at each step.,Data Wrangling,Package,David Ranzolin,,,https://github.com/daranzolin/ViewPipeSteps,https://github.com/daranzolin/ViewPipeSteps/raw/master/inst/daranzolin_ViewPipeSteps.gif,https://raw.githubusercontent.com/rfortherestofus/rru-website/master/plots/view-pipe-steps.png,plots/view-pipe-steps.png
data.table,"data.table is a package for data importing and wrangling. It has an emphasis on speed when working with large datasets.
","Data Wrangling,Data Import",Package,"Arun Srinivasan,Matt Dowle",,,https://rdatatable.gitlab.io/data.table/,https://raw.githubusercontent.com/Rdatatable/data.table/master/.graphics/logo.png,https://raw.githubusercontent.com/rfortherestofus/rru-website/master/plots/data-table.png,plots/data-table.png
Data wrangling for spatial analysis: R Workshop,"These materials are designed to ""train you in the basic skills you need to be proficient at spatial analysis and mapping"" in R. They look at ""data wrangling, with a focus on its application to spatial data,"" as well as ""some spatial statistics and mapping.""
","Data Wrangling,Mapping/Geospatial",Learning Resource,"Chris Brown,David Schoeman",,"sf,raster,tidyverse,readr,dplyr,ggplot2",https://www.seascapemodels.org/data/data-wrangling-spatial-course.html,,https://raw.githubusercontent.com/rfortherestofus/rru-website/master/plots/data-wrangling-for-spatial-analysis-r-workshop.png,plots/data-wrangling-for-spatial-analysis-r-workshop.png
stringr.plus,"This package provides a few additional functions to supplement those in the string package. They include str_extract_before(), str_extract_after(), and others.
","Data Wrangling,Strings",Package,John Cassil,,stringr,https://github.com/johncassil/stringr.plus,https://github.com/johncassil/stringr.plus/raw/main/man/figures/logo.png,https://raw.githubusercontent.com/rfortherestofus/rru-website/master/plots/stringr-plus.png,plots/stringr-plus.png
RStudio Cloud Primer: Tidy Your Data,"A tutorial to ""unlock the tidyverse by learning how to make and use tidy data, the data format designed for R.""
","Data Wrangling,Tidy Data",Learning Resource,RStudio,,"tidyr,dplyr",https://rstudio.cloud/learn/primers/4,https://rstudio.cloud/images/primers/thumb3.svg,https://raw.githubusercontent.com/rfortherestofus/rru-website/master/plots/r-studio-cloud-primer-tidy-your-data.png,plots/r-studio-cloud-primer-tidy-your-data.png
Tidy Data Vignette,This article lays out the principles of tidy data and shows how you can use the tidyr package to get your data into this format.,"Data Wrangling,Tidy Data",Learning Resource,"Hadley Wickham,Lionel Henry,RStudio",,,https://tidyr.tidyverse.org/articles/tidy-data.html,,https://raw.githubusercontent.com/rfortherestofus/rru-website/master/plots/tidy-data-vignette.png,plots/tidy-data-vignette.png
tidyr,"The tidyr package is designed to help you get data into tidy format. With functions to go from wide data to long data, deal with missing values, and more, it provides a toolkit to ensure your data follows tidy principles.
","Data Wrangling,Tidy Data",Package,"Hadley Wickham,RStudio",,,https://tidyr.tidyverse.org/index.html,https://github.com/tidyverse/tidyr/raw/master/man/figures/logo.png,https://raw.githubusercontent.com/rfortherestofus/rru-website/master/plots/tidyr.png,plots/tidyr.png
A Scientist's Guide to R: Step 2.5 - dates & times,"Working with dates and times in R can be challenging. This article shows you how to use the lubridate package to work with dates and times.
",Dates and Times,Learning Resource,Craig Hutton,,lubridate,https://craig.rbind.io/post/2020-10-10-asgr-2-5-dates/,,https://raw.githubusercontent.com/rfortherestofus/rru-website/master/plots/a-scientists-guide-to-r-step-2-5-dates-times.png,plots/a-scientists-guide-to-r-step-2-5-dates-times.png
Date Night: using lubridate to work with dates in R,"This presentation gives some examples of how the lubridate package can help you work with dates. Also see the <a href=""https://jenrichmond.github.io/slides/lubridate.html"">accompanying slides</a>.
",Dates and Times,Learning Resource,Jen Richmond,,lubridate,https://www.youtube.com/watch?v=B765xONVhjY,,https://raw.githubusercontent.com/rfortherestofus/rru-website/master/plots/date-night-using-lubridate-to-work-with-dates-in-r.png,plots/date-night-using-lubridate-to-work-with-dates-in-r.png
"R for Data Science, Chapter 16: Dates and Times",This chapter of R for Data Science shows how to work with dates and times in R using the lubridate package.,Dates and Times,Learning Resource,"Hadley Wickham,Garrett Grolmund",,lubridate,https://r4ds.had.co.nz/dates-and-times.html,,https://raw.githubusercontent.com/rfortherestofus/rru-website/master/plots/r-for-data-science-chapter-16-dates-and-times.png,plots/r-for-data-science-chapter-16-dates-and-times.png
lubridate,lubridate is a tidyverse-friendly package to simplify the process of working with dates and times.,Dates and Times,Package,"Vitalie Spinu,Hadley Wickham,Garrett Grolmund",,"""R for Data Science, Chapter 16: Dates and Times""",https://lubridate.tidyverse.org/,https://github.com/tidyverse/lubridate/raw/master/man/figures/logo.png,https://raw.githubusercontent.com/rfortherestofus/rru-website/master/plots/lubridate.png,plots/lubridate.png
A Scientist's Guide to R: Step 2.4 - forcats for factors,"Factors are how R deals with categorical data with a known number of options. This article will help you understand how factors work.
",Factors,Learning Resource,Craig Hutton,,forcats,https://craig.rbind.io/post/2020-08-29-asgr-2-4-factors/,,https://raw.githubusercontent.com/rfortherestofus/rru-website/master/plots/a-scientists-guide-to-r-step-2-4-forcats-for-factors.png,plots/a-scientists-guide-to-r-step-2-4-forcats-for-factors.png
Working with categorical data in R without losing your mind,"Categorical data, called “factor” data in R, presents unique challenges in data wrangling. R users often look down at tools like Excel for automatically coercing variables to incorrect datatypes, but factor data in R can produce very similar issues. The stringsAsFactors=HELLNO movement and standard Tidyverse defaults have moved us away from the use of factors, but they are sometimes still necessary for analysis. This talk will outline common problems arising from categorical variable transformations in R, and show strategies to avoid them, using both base R and the Tidyverse (particularly, dplyr and forcats functions).",Factors,Learning Resource,Amelia McNamara,,"tidyverse,forcats",https://rstudio.com/resources/rstudioconf-2019/working-with-categorical-data-in-r-without-losing-your-mind/,,https://raw.githubusercontent.com/rfortherestofus/rru-website/master/plots/working-with-categorical-data-in-r-without-losing-your-mind.png,plots/working-with-categorical-data-in-r-without-losing-your-mind.png
Wrangling categorical data in R,"Data wrangling is a critical foundation of data science, and wrangling of categorical data is an important component of this process. However, categorical data can introduce unique issues in data wrangling, particularly in real-world settings with collaborators and periodically-updated dynamic data. This paper discusses common problems arising from categorical variable transformations in R, demonstrates the use of factors, and suggests approaches to address data wrangling challenges. For each problem, we present at least two strategies for management, one in base R and the other from the ‘tidyverse.’ We consider several motivating examples, suggest defensive coding strategies, and outline principles for data wrangling to help ensure data quality and sound analysis.",Factors,Learning Resource,"Amelia McNamara,Nicholas Horton",,"tidyverse,forcats",https://peerj.com/preprints/3163,,https://raw.githubusercontent.com/rfortherestofus/rru-website/master/plots/wrangling-categorical-data-in-r.png,plots/wrangling-categorical-data-in-r.png
forcats,"R uses factors to handle categorical variables, variables that have a fixed and known set of possible values. Factors are also helpful for reordering character vectors to improve display. The goal of the forcats package is to provide a suite of tools that solve common problems with factors, including changing the order of levels or the values. Some examples include:",Factors,Package,Hadley Wickham,,tidyverse,https://forcats.tidyverse.org/,https://github.com/tidyverse/forcats/raw/master/man/figures/logo.png,https://raw.githubusercontent.com/rfortherestofus/rru-website/master/plots/forcats.png,plots/forcats.png
Rendering your README with GitHub Actions,"Learn how to automate generate a README on your GitHub repository using GitHub Actions.
","GitHub Actions,Automation",Learning Resource,Gavin Simpson,,"usethis,A Twitter bot with {rtweet} and GitHub Actions",https://fromthebottomoftheheap.net/2020/04/30/rendering-your-readme-with-github-actions/?s=09,,https://raw.githubusercontent.com/rfortherestofus/rru-website/master/plots/rendering-your-readme-with-git-hub-actions.png,plots/rendering-your-readme-with-git-hub-actions.png
broom,"The broom packages enables you to take output from statistical models and convert it into tidy tibbles. Practically speaking, this means you can easily access elements of the output (e.g. pull out p-values to include in text in an RMarkdown document).
",Inferential Statistics,Package,"David Robinson,Alex Hayes,Simon Couch",,tidyr,https://broom.tidymodels.org/index.html,https://raw.githubusercontent.com/tidymodels/broom/master/man/figures/logo.png,https://raw.githubusercontent.com/rfortherestofus/rru-website/master/plots/broom.png,plots/broom.png
"Interactive web-based data visualization with R, plotly, and shiny",This book provides an overview of the plotly package and has chapters that lay out how to make a wide range of graphs using it.,"Interactive,Mapping/Geospatial,Data Visualization,Shiny",Learning Resource,Carson Sievert,,plotly,https://plotly-r.com/,,https://raw.githubusercontent.com/rfortherestofus/rru-website/master/plots/interactive-web-based-data-visualization-with-r-plotly-and-shiny.png,plots/interactive-web-based-data-visualization-with-r-plotly-and-shiny.png
Geocomputation with R,"Geocomputation with R is ""a book on geographic data analysis, visualization and modeling."" An in-depth yet approachable book, it is a great place to start (and a great reference) for those looking to learn about making maps in R.",Mapping/Geospatial,Learning Resource,"Robin Lovelace,Jakub Nowosad,Jannes Muenchow",,"sf,tmap,ggspatial,leaflet,mapdeck,plotly,geogrid,geofacet,tilemaps",https://geocompr.robinlovelace.net/,,https://raw.githubusercontent.com/rfortherestofus/rru-website/master/plots/geocomputation-with-r.png,plots/geocomputation-with-r.png
Personal Art Map with R,"This blog post shows how to use the ggplot2 and sf packages to make a beautiful map.
",Mapping/Geospatial,Learning Resource,Esteban Moro,,"sf,ggplot2",http://estebanmoro.org/post/2020-10-19-personal-art-map-with-r/,,https://raw.githubusercontent.com/rfortherestofus/rru-website/master/plots/personal-art-map-with-r.png,plots/personal-art-map-with-r.png
"R as GIS, Part 1","This article walks through some of the basics of using R as a GIS tool.
",Mapping/Geospatial,Learning Resource,Lionel Hertzog,,sf,https://datascienceplus.com/r-as-gis-part-1-vector/,,https://raw.githubusercontent.com/rfortherestofus/rru-website/master/plots/r-as-gis-part-1.png,plots/r-as-gis-part-1.png
raster,"The raster package has functions for creating, reading, manipulating, and writing raster data. 
",Mapping/Geospatial,Package,Robert Hijmans,,,https://rspatial.org/raster/pkg/index.html,,https://raw.githubusercontent.com/rfortherestofus/rru-website/master/plots/raster.png,plots/raster.png
sf,The sf package provides tools for working with simple features geospatial data.,Mapping/Geospatial,Package,Edzer Pebesma,,Geocomputation with R,https://r-spatial.github.io/sf/,https://user-images.githubusercontent.com/520851/34887433-ce1d130e-f7c6-11e7-83fc-d60ad4fae6bd.gif,https://raw.githubusercontent.com/rfortherestofus/rru-website/master/plots/sf.png,plots/sf.png
snapbox,Add static basemaps from mapbox to maps made with ggplot2.,Mapping/Geospatial,Package,"Miles McBain,Anthony North",,ggplot2,https://github.com/anthonynorth/snapbox,,https://raw.githubusercontent.com/rfortherestofus/rru-website/master/plots/snapbox.png,plots/snapbox.png
tilemaps,This package is designed to take a map and turn it into equally-spaced tile maps.,Mapping/Geospatial,Package,Kaelyn Rosenberg,,geogrid,https://kaerosen.github.io/tilemaps/,https://kaerosen.github.io/tilemaps/reference/figures/logo.png,https://raw.githubusercontent.com/rfortherestofus/rru-website/master/plots/tilemaps.png,plots/tilemaps.png
tmap,"tmap is package designed to help you quickly make static and interactive maps.
",Mapping/Geospatial,Package,Martijn Tennekes,,Geocomputation with R,https://cran.r-project.org/web/packages/tmap/vignettes/tmap-getstarted.html,,https://raw.githubusercontent.com/rfortherestofus/rru-website/master/plots/tmap.png,plots/tmap.png
zipcodeR,"zipcodeR is an R library that makes working with ZIP codes in R easier. It provides data on all U.S. ZIP codes using multiple open data sources, making it easier for social science researchers and data scientists to work with ZIP code-level data in projects.",Mapping/Geospatial,Package,Gavin Rozzi,,,https://gavinrozzi.github.io/zipcodeR/index.html,https://gavinrozzi.github.io/zipcodeR/reference/figures/logo.png,https://raw.githubusercontent.com/rfortherestofus/rru-website/master/plots/zipcode-r.png,plots/zipcode-r.png
tigris,"""tigris is an R package that allows users to directly download and use TIGER/Line shapefiles from the US Census Bureau.""","Mapping/Geospatial,Data Import",Package,Kyle Walker,,tidycensus,https://github.com/walkerke/tigris,,https://raw.githubusercontent.com/rfortherestofus/rru-website/master/plots/tigris.png,plots/tigris.png
geofacet,geofacet enables you to make small multiple plots laid out in grids that are designed to represent the shapes of geographic areas (e.g. states in the United States).,"Mapping/Geospatial,Data Visualization",Learning Resource,Ryan Hafen,,ggplot2,https://hafen.github.io/geofacet/,,https://raw.githubusercontent.com/rfortherestofus/rru-website/master/plots/geofacet.png,plots/geofacet.png
geogrid,"The geogrid packages enables you to ""turn geospatial polygons like states, counties or local authorities into regular or hexagonal grids automatically.""
","Mapping/Geospatial,Data Visualization",Package,Joseph Bailey,,"tilemaps,geofacet",https://github.com/jbaileyh/geogrid,,https://raw.githubusercontent.com/rfortherestofus/rru-website/master/plots/geogrid.png,plots/geogrid.png
ggspatial,"ggspatial provides additional functionality to maps created with ggplot2. For example, it has a function to add a scalebar to help users measure distances in maps.","Mapping/Geospatial,Data Visualization",Package,Dewey Dunnington,,ggplot2,https://paleolimbot.github.io/ggspatial/index.html,,https://raw.githubusercontent.com/rfortherestofus/rru-website/master/plots/ggspatial.png,plots/ggspatial.png
leaflet,The leaflet package provides an interface to the popular javascript library of the same name that enables you to make interactive maps.,"Mapping/Geospatial,Data Visualization,Interactive",Package,RStudio,,mapdeck,https://rstudio.github.io/leaflet/,,https://raw.githubusercontent.com/rfortherestofus/rru-website/master/plots/leaflet.png,plots/leaflet.png
mapdeck,mapdeck is a package for making interactive maps.,"Mapping/Geospatial,Interactive,Data Visualization",Package,David Cooley,,leaflet,https://symbolixau.github.io/mapdeck/,,https://raw.githubusercontent.com/rfortherestofus/rru-website/master/plots/mapdeck.png,plots/mapdeck.png
rtweet,"rtweet lets you access data from Twitter in order to analyze it in R.
",Misc,Package,Mike Kearney,,,https://docs.ropensci.org/rtweet/index.html,https://docs.ropensci.org/rtweet/reference/figures/logo.png,https://raw.githubusercontent.com/rfortherestofus/rru-website/master/plots/rtweet.png,plots/rtweet.png
usethis workflow for package development,This blog post is an overview of how the usethis package can help you to create your own R package.,Package Development,Learning Resource,Emil Hvitfeldt,,usethis,https://www.hvitfeldt.me/blog/usethis-workflow-for-package-development/,,https://raw.githubusercontent.com/rfortherestofus/rru-website/master/plots/usethis-workflow-for-package-development.png,plots/usethis-workflow-for-package-development.png
usethis,usethis is very meta: it's an R package design to help you make your own R package.,Package Development,Package,"Hadley Wickham,Jenny Bryan",,,https://usethis.r-lib.org/,https://usethis.r-lib.org/reference/figures/logo.png,https://raw.githubusercontent.com/rfortherestofus/rru-website/master/plots/usethis.png,plots/usethis.png
stringr,"""The stringr package provide a cohesive set of functions designed to make working with strings as easy as possible.""",Strings,Package,Hadley Wickham,,stringr.plus,https://stringr.tidyverse.org/,https://github.com/tidyverse/stringr/raw/master/man/figures/logo.png,https://raw.githubusercontent.com/rfortherestofus/rru-website/master/plots/stringr.png,plots/stringr.png
A Scientist's Guide to R: Step 2.3 - string manipulation and regex,Covers some of the core functions of the stringr package and has a section on regular expressions for pattern matching.,"Strings,Regular Expressions",Learning Resource,Craig Hutton,,stringr,https://craig.rbind.io/post/2020-06-28-asgr-2-3-string-manipulation/,,https://raw.githubusercontent.com/rfortherestofus/rru-website/master/plots/a-scientists-guide-to-r-step-2-3-string-manipulation-and-regex.png,plots/a-scientists-guide-to-r-step-2-3-string-manipulation-and-regex.png
10+ Guidelines for Better Tables in R,"This blog post takes <a href=""https://twitter.com/jschwabish/status/1290323581881266177"">table-making guidelines laid out by data visualization expert Jon Schwabish</a> and shows how they can be achieved using the gt package.",Tables,Learning Resource,Thomas Mock,,gt,https://themockup.blog/posts/2020-09-04-10-table-rules-in-r/,,https://raw.githubusercontent.com/rfortherestofus/rru-website/master/plots/x10-guidelines-for-better-tables-in-r.png,plots/x10-guidelines-for-better-tables-in-r.png
Functions and Themes for gt tables,This blog post shows how to make nice tables using the gt package.,Tables,Learning Resource,Thomas Mock,,gt,https://themockup.blog/posts/2020-09-26-functions-and-themes-for-gt-tables/,,https://raw.githubusercontent.com/rfortherestofus/rru-website/master/plots/functions-and-themes-for-gt-tables.png,plots/functions-and-themes-for-gt-tables.png
gt Workshop 2020!,Materials from a 2020 workshop about the gt R package.,Tables,Learning Resource,Richard Iannone,,gt,https://github.com/rich-iannone/gt-workshop-2020,,https://raw.githubusercontent.com/rfortherestofus/rru-website/master/plots/gt-workshop-2020.png,plots/gt-workshop-2020.png
Reactable Tutorial,"This tutorial walks through several features of the reactable package for making interactive tables.

",Tables,Learning Resource,"Vineet Choudhury,Julia Large",,reactable,https://vchoudhury.shinyapps.io/reactable_tutorial/,,https://raw.githubusercontent.com/rfortherestofus/rru-website/master/plots/reactable-tutorial.png,plots/reactable-tutorial.png
gt,The gt package aims to create a grammar of tables (similar to the grammar of graphics that underlies ggplot2) and use this to help users create attractive tables that communicate effectively.,Tables,Package,Richard Iannone,,"Functions and Themes for gt tables,10+ Guidelines for Better Tables in R",https://gt.rstudio.com/,https://github.com/rstudio/gt/raw/master/man/figures/logo.svg,https://raw.githubusercontent.com/rfortherestofus/rru-website/master/plots/gt.png,plots/gt.png
reactable,"The reactable package makes interactive data tables for R, based on the <a href=""https://github.com/tannerlinsley/react-table"">React Table</a> library and made with <a href=""https://github.com/react-R/reactR"">reactR</a>.
",Tables,Package,Greg Lin,,,https://glin.github.io/reactable/,,https://raw.githubusercontent.com/rfortherestofus/rru-website/master/plots/reactable.png,plots/reactable.png
tidy data,This Twitter thread explains the concept of tidy data with clear descriptions and illustrations.,Tidy Data,Learning Resource,"Julia Lowndes,Allison Horst",,,https://twitter.com/juliesquid/status/1315710359404113920,,https://raw.githubusercontent.com/rfortherestofus/rru-website/master/plots/tidy-data.png,plots/tidy-data.png
What is Takes to Tidy Census Data,"This walkthrough provides an example of cleaning Census data to demonstrate principles of tidy data.
","Tidy Data,Data Cleaning",Learning Resource,Isabella Velásquez,,tidycensus,https://ivelasq.rbind.io/blog/tidying-census-data/,,https://raw.githubusercontent.com/rfortherestofus/rru-website/master/plots/what-is-takes-to-tidy-census-data.png,plots/what-is-takes-to-tidy-census-data.png
Pivoting tidily,"This blog post provides an overview of the pivot functions — pivot_longer() and pivot_wider() — from the tidyr package.
","Tidy Data,Data Wrangling",Learning Resource,Gavin Simpson,,tidyr,https://fromthebottomoftheheap.net/2019/10/25/pivoting-tidily/,,https://raw.githubusercontent.com/rfortherestofus/rru-website/master/plots/pivoting-tidily.png,plots/pivoting-tidily.png
How to Make Slides in R Using xaringan,"An overview of the xaringan package.
",Slides,Learning Resource,Zhi Yang,xaringan,xaringan,https://xaringantutorial.netlify.app/#1,,https://raw.githubusercontent.com/rfortherestofus/rru-website/master/plots/how-to-make-slides-in-r-using-xaringan.png,plots/how-to-make-slides-in-r-using-xaringan.png
Meet xaringan: making slides in RMarkdown,"A presentation from the 2019 rstudio::conf about the xaringan package.

",Slides,Learning Resource,Alison Hill,xaringan,xaringan,https://arm.rbind.io/slides/xaringan.html#1,,https://raw.githubusercontent.com/rfortherestofus/rru-website/master/plots/meet-xaringan-making-slides-in-r-markdown.png,plots/meet-xaringan-making-slides-in-r-markdown.png
flair,The goal of flair is to is to provide tools for formatting R code in knitted R Markdown files.,Slides,Package,Kelly Bodwin,xaringan,xaringan,https://r-for-educators.github.io/flair/index.html,https://r-for-educators.github.io/flair/reference/figures/flair_hex.png,https://raw.githubusercontent.com/rfortherestofus/rru-website/master/plots/flair.png,plots/flair.png
xaringan,,Slides,Package,Yihui Xie,xaringan,xaringan,https://slides.yihui.org/xaringan/,https://upload.wikimedia.org/wikipedia/commons/b/be/Sharingan_triple.svg,https://raw.githubusercontent.com/rfortherestofus/rru-website/master/plots/xaringan.png,plots/xaringan.png
xaringanBuilder,"A package to easily export your xaringan slides to html, PDF, GIF, PPTX, and PNG formats.",Slides,Package,John Helveston,xaringan,xaringan,https://jhelvy.github.io/xaringanBuilder/index.html,,https://raw.githubusercontent.com/rfortherestofus/rru-website/master/plots/xaringan-builder.png,plots/xaringan-builder.png
xaringancolor,"A package to help you seamlessly use colors across text, code, and equations in #xaringan slides.",Slides,Package,Emil Hvitfeldt,xaringan,xaringan,https://github.com/EmilHvitfeldt/xaringancolor,https://github.com/EmilHvitfeldt/xaringancolor/raw/master/man/figures/logo.png,https://raw.githubusercontent.com/rfortherestofus/rru-website/master/plots/xaringancolor.png,plots/xaringancolor.png
xaringanExtra,"Billed as a ""playground of extensions for xaringan,"" this package allows you to add animations, a tile view to show all of your slides, the ability to add a logo, and much more. 
",Slides,Package,Garrick Aden-Buie,xaringan,xaringan,https://pkg.garrickadenbuie.com/xaringanExtra/#/,,https://raw.githubusercontent.com/rfortherestofus/rru-website/master/plots/xaringan-extra.png,plots/xaringan-extra.png
