title,description,category,type,creator_s,collection,related_resource,url,logo,featured_image,filename
Designing ggplots: making clear figures that communicate,"Materials from a 2019 workshop. Original description: ""In this interactive workshop, you will make ggplot2 data visualizations clearer and more communicative. You’ll learn to declutter plots using highlighting, direct labeling, and by designing figures with better legends (or no legends at all). To make beautiful, expressive plots, we’ll view strategies you already know, like faceting, from a design perspective; hack geoms, legends, and the plot itself; and learn extension packages that let us do incredible things, like cowplot, gghighlight, and ggrepel. Along the way, we’ll take advantage of useful tools for working with color. We’ll also explore storytelling with data by annotating plots and combining plots with the patchwork package in a way that builds your narrative.""",Data Visualization,Learning Resource,Malcolm Barrett,,ggplot2,https://malco.io/talk/designing-ggplots/,,https://raw.githubusercontent.com/rfortherestofus/rru-website/master/plots/designing-ggplots-making-clear-figures-that-communicate.png,plots/designing-ggplots-making-clear-figures-that-communicate.png
How to write an R package,"""R packages are great for organizing your own work, not only sharing with others. See how to create an R package in a few simple steps, thanks to packages like devtools, usethis, and roxygen2.""",Package Development,Learning Resource,Sharon Machlis,,,https://www.infoworld.com/article/3346261/how-to-write-an-r-package.html,,https://raw.githubusercontent.com/rfortherestofus/rru-website/master/plots/how-to-write-an-r-package.png,plots/how-to-write-an-r-package.png
R Packages,This book provides an overview of how to develop R packages.,Package Development,Learning Resource,"Hadley Wickham,Jenny Bryan",,,https://r-pkgs.org/,,https://raw.githubusercontent.com/rfortherestofus/rru-website/master/plots/r-packages.png,plots/r-packages.png
Writing an R package from scratch,"A blog post that walks through the process of developing an R package.
",Package Development,Learning Resource,Tom Westlake,,,https://r-mageddon.netlify.app/post/writing-an-r-package-from-scratch/,,https://raw.githubusercontent.com/rfortherestofus/rru-website/master/plots/writing-an-r-package-from-scratch.png,plots/writing-an-r-package-from-scratch.png
usethis workflow for package development,This blog post outlines the basic process of creating an R package using the `usethis` package.,Package Development,Learning Resource,Emil Hvitfeldt,,usethis,https://www.hvitfeldt.me/blog/usethis-workflow-for-package-development/,,https://raw.githubusercontent.com/rfortherestofus/rru-website/master/plots/usethis-workflow-for-package-development_2.png,plots/usethis-workflow-for-package-development_2.png
RVerbalExpressions,This package is designed to help you more easily create regular expressions.,Regular Expressions,Package,Tyler Littlefield,,,https://rverbalexpressions.netlify.app/index.html,https://rverbalexpressions.netlify.app/reference/figures/logo.png,https://raw.githubusercontent.com/rfortherestofus/rru-website/master/plots/r-verbal-expressions.png,plots/r-verbal-expressions.png
RegExplain,"""RegExplain is an RStudio addin slash utility belt for regular expressions. Interactively build your regexp, check the output of common string matching functions, consult the interactive help pages, or use the included resources to learn regular expressions.""
",Regular Expressions,Package,Garrick Aden-Buie,,,https://www.garrickadenbuie.com/project/regexplain/,,https://raw.githubusercontent.com/rfortherestofus/rru-website/master/plots/reg-explain.png,plots/reg-explain.png
naniar,"""naniar provides principled, tidy ways to summarise, visualise, and manipulate missing data with minimal deviations from the workflows in ggplot2 and tidy data.""",Data Wrangling,Package,"Nicholas Tierney,Di Cook,Miles McBain,Colin Fay",,,http://naniar.njtierney.com/,http://naniar.njtierney.com/reference/figures/logo.png,https://raw.githubusercontent.com/rfortherestofus/rru-website/master/plots/naniar.png,plots/naniar.png
unheadr,"""The goal of unheadr is to help wrangle data when it has embedded subheaders, or when values are wrapped across several rows.""",Data Wrangling,Package,Luis D. Verde Arregoitia,,,https://unheadr.liomys.mx/,https://unheadr.liomys.mx/reference/figures/logosmall.png,https://raw.githubusercontent.com/rfortherestofus/rru-website/master/plots/unheadr.png,plots/unheadr.png
R Markdown Cookbook,"""This book is designed to provide a range of examples on how to extend the functionality of your R Markdown documents. As a cookbook, this guide is recommended to new and intermediate R Markdown users who desire to enhance the efficiency of using R Markdown and also explore the power of R Markdown.""
",RMarkdown,Learning Resource,"Yihui Xie,Christophe Dervieux,Emily Riederer",,,https://bookdown.org/yihui/rmarkdown-cookbook/,https://bookdown.org/yihui/rmarkdown-cookbook/images/cover.png,https://raw.githubusercontent.com/rfortherestofus/rru-website/master/plots/r-markdown-cookbook.png,plots/r-markdown-cookbook.png
officedown,"""The package facilitates the formatting of Microsoft Word documents produced by R Markdown documents by providing a range of features.""
",RMarkdown,Package,David Gohel,,,https://davidgohel.github.io/officedown/,https://davidgohel.github.io/officedown/reference/figures/logo.png,https://raw.githubusercontent.com/rfortherestofus/rru-website/master/plots/officedown.png,plots/officedown.png
flextable,"If you are knitting to Word, your best for tables is the flextable package (though the tables this package produces can also be embedded within HTML and PDF outputs). Designed by David Gohel, the flextable package provides a straightforward syntax to shape the content and format of your tables.",Tables,Package,David Gohel,,,https://davidgohel.github.io/flextable/index.html,https://davidgohel.github.io/flextable/reference/figures/logo.png,https://raw.githubusercontent.com/rfortherestofus/rru-website/master/plots/flextable.png,plots/flextable.png
RMarkdown for Scientists,"""This is a book on Rmarkdown, aimed for scientists. It was initially developed as a 3 hour workshop, but is now developed into a resource that will grow and change over time as a living book.""",RMarkdown,Learning Resource,Nicholas Tierney,,,https://rmd4sci.njtierney.com/,,https://raw.githubusercontent.com/rfortherestofus/rru-website/master/plots/r-markdown-for-scientists.png,plots/r-markdown-for-scientists.png
Branding and automating your work with R Markdown,"This talk from rstudio::conf 2018 highlights ways to ensure that documents produced with RMarkdown match your organizational branding.
",RMarkdown,Learning Resource,Daniel Hadley,,,https://rstudio.com/resources/rstudioconf-2018/branding-and-automating-your-work-with-r-markdown/,,https://raw.githubusercontent.com/rfortherestofus/rru-website/master/plots/branding-and-automating-your-work-with-r-markdown.png,plots/branding-and-automating-your-work-with-r-markdown.png
R Markdown: The Definitive Guide,This book provides an overview of some of the capabilities of RMarkdown.,RMarkdown,Learning Resource,"Yihui Xie,JJ Allaire,Garrett Grolmund",,,https://bookdown.org/yihui/rmarkdown/,https://bookdown.org/yihui/rmarkdown/images/cover.png,https://raw.githubusercontent.com/rfortherestofus/rru-website/master/plots/r-markdown-the-definitive-guide.png,plots/r-markdown-the-definitive-guide.png
RMarkdown Tutorials,This set of interactive tutorials walks you through RMarkdown from scratch to advanced applications.,RMarkdown,Learning Resource,RStudio,,,https://rmarkdown.rstudio.com/lesson-1.html,,https://raw.githubusercontent.com/rfortherestofus/rru-website/master/plots/r-markdown-tutorials.png,plots/r-markdown-tutorials.png
Parameterized Reporting with RMarkdown,"Parameterized reporting is a feature of RMarkdown that allows you to design a single report template and then use it to generate tens, hundreds, even thousands of reports at the same time. This video shows how it works.",RMarkdown,Learning Resource,David Keyes,,,https://rfortherestofus.com/2020/10/parameterized-reporting-with-rmarkdown/,,https://raw.githubusercontent.com/rfortherestofus/rru-website/master/plots/parameterized-reporting-with-r-markdown.png,plots/parameterized-reporting-with-r-markdown.png
Iterate parameterised {xaringan} reports,"This blog post walks through how to generate multiple presentations using parameterized reporting and RMarkdown
.",RMarkdown,Learning Resource,Matt Dray,,,https://www.rostrum.blog/2020/03/12/knit-with-params/,,https://raw.githubusercontent.com/rfortherestofus/rru-website/master/plots/iterate-parameterised-xaringan-reports.png,plots/iterate-parameterised-xaringan-reports.png
Iterated fact sheets with R Markdown,This article shows how to create multiple reports simultaneously using RMarkdown and parameterized reporting.,RMarkdown,Learning Resource,Urban Institute,,,https://urban-institute.medium.com/iterated-fact-sheets-with-r-markdown-d685eb4eafce,,https://raw.githubusercontent.com/rfortherestofus/rru-website/master/plots/iterated-fact-sheets-with-r-markdown.png,plots/iterated-fact-sheets-with-r-markdown.png
Solving iteration problems with purrr,This 2017 workshop gives an overview of iteration with the purrr package.,Iteration,Learning Resource,Charlotte Wickham,,purrr,https://www.youtube.com/watch?v=7UlWJWfZO9M,,https://raw.githubusercontent.com/rfortherestofus/rru-website/master/plots/solving-iteration-problems-with-purrr.png,plots/solving-iteration-problems-with-purrr.png
purrr tutorial,A set of tutorials to help you learn iteration with the purrr package.,Iteration,Learning Resource,Jenny Bryan,,purrr,https://jennybc.github.io/purrr-tutorial/,,https://raw.githubusercontent.com/rfortherestofus/rru-website/master/plots/purrr-tutorial.png,plots/purrr-tutorial.png
R for Data Science: Chapter 21: Iteration,This chapter demonstrates various methods for using iteration with the purrr package.,Iteration,Learning Resource,"Hadley Wickham,Garrett Grolmund",,purrr,https://r4ds.had.co.nz/iteration.html,,https://raw.githubusercontent.com/rfortherestofus/rru-website/master/plots/r-for-data-science-chapter-21-iteration.png,plots/r-for-data-science-chapter-21-iteration.png
R for Data Science: Chapter 3: Data Visualization,This chapter gives an overview of data visualization in R with the ggplot2 package.,Data Visualization,Learning Resource,"Hadley Wickham,Garrett Grolmund",,"purrr,ggplot2",https://r4ds.had.co.nz/data-visualisation.html,,https://raw.githubusercontent.com/rfortherestofus/rru-website/master/plots/r-for-data-science-chapter-3-data-visualization.png,plots/r-for-data-science-chapter-3-data-visualization.png
kableExtra,This package works together with kable to make attractive tables.,Tables,Package,Hao Zhu,,,https://cran.r-project.org/web/packages/kableExtra/vignettes/awesome_table_in_html.html,https://camo.githubusercontent.com/84624c361fada90aed38c52d4b615339d5026988eddb96133485951e125b2eb3/68747470733a2f2f68616f7a68753233332e6769746875622e696f2f6b61626c6545787472612f6b61626c6545787472612e737667,https://raw.githubusercontent.com/rfortherestofus/rru-website/master/plots/kable-extra.png,plots/kable-extra.png
formattable,"Kun Ren’s formattable package “is designed for applying formatting on vectors and data frames to make data presentation easier, richer, more flexible and hopefully convey more information.”

One of the most unique features is the ability to add colors, background shading, bars, and other features that move tables beyond hulking blocks of text.",Tables,Package,"Kun Ren,Kenton Russell",,,https://renkun-ken.github.io/formattable/,,https://raw.githubusercontent.com/rfortherestofus/rru-website/master/plots/formattable.png,plots/formattable.png
Create stylish tables in R using formattable,This blog post demonstrates the unique features of the formattable package.,Tables,Learning Resource,Laura Ellis,,formattable,https://www.littlemissdata.com/blog/prettytables,,https://raw.githubusercontent.com/rfortherestofus/rru-website/master/plots/create-stylish-tables-in-r-using-formattable.png,plots/create-stylish-tables-in-r-using-formattable.png
DT,"The main appeal of the DT package is its ability to add filtering, pagination, and sorting to HTML tables. Users can slice, scroll through, and arrange tables in ways that help them to make sense of your results.",Tables,Package,"Yihui Xie,Joe Cheng,Xianying Tan",,,https://rstudio.github.io/DT/,,https://raw.githubusercontent.com/rfortherestofus/rru-website/master/plots/dt.png,plots/dt.png
Tidy Tuesday live screencast: Analyzing global crop yields in R,This screencast provides an example of building a Shiny app from scratch.,Shiny,Learning Resource,David Robinson,,shiny,https://www.youtube.com/watch?v=0uqAhIiK9Rc,,https://raw.githubusercontent.com/rfortherestofus/rru-website/master/plots/tidy-tuesday-live-screencast-analyzing-global-crop-yields-in-r.png,plots/tidy-tuesday-live-screencast-analyzing-global-crop-yields-in-r.png
shiny,The shiny package provides tools to make interactive apps that respond to use input.,Shiny,Package,"Winston Chang,Joe Cheng,JJ Allaire,Carson Sievert,Barret Schloerke,Yihui Xie,Jeff Allen,Jonathan McPherson,Alan Dipert,Barbara Borges",,,https://shiny.rstudio.com/,,https://raw.githubusercontent.com/rfortherestofus/rru-website/master/plots/shiny.png,plots/shiny.png
Shiny Tutorial,"A set of tutorials that teach the fundamentals of Shiny.
",Shiny,Learning Resource,RStudio,,shiny,https://shiny.rstudio.com/tutorial/,,https://raw.githubusercontent.com/rfortherestofus/rru-website/master/plots/shiny-tutorial.png,plots/shiny-tutorial.png
Mastering Shiny,"This book provides a comprehensive guide to Shiny.
",Shiny,Learning Resource,Hadley Wickham,,shiny,https://mastering-shiny.org/,https://d33wubrfki0l68.cloudfront.net/0c97eee3d8fc820f3a8d670c08b286e8a524257b/e426c/cover.png,https://raw.githubusercontent.com/rfortherestofus/rru-website/master/plots/mastering-shiny.png,plots/mastering-shiny.png
Building Shiny apps - an interactive tutorial,"This blog post walks you through the process of setting up your first Shiny app.
",Shiny,Learning Resource,Dean Attali,,shiny,https://deanattali.com/blog/building-shiny-apps-tutorial/,,https://raw.githubusercontent.com/rfortherestofus/rru-website/master/plots/building-shiny-apps-an-interactive-tutorial.png,plots/building-shiny-apps-an-interactive-tutorial.png
a gRadual intRoduction to Shiny,Materials from an introductory workshop to basic shiny concepts.,Shiny,Learning Resource,"Ted Laderas,Jessica Minnier,Pierrette Lo,Dar'ya Pozhidayeva",,shiny,https://laderast.github.io/gradual_shiny/,,https://raw.githubusercontent.com/rfortherestofus/rru-website/master/plots/a-g-radual-int-roduction-to-shiny.png,plots/a-g-radual-int-roduction-to-shiny.png
Hands-on demonstration of {golem}!,"In this episode of the Shiny Developer Series, host Eriz Nantz talks with the developer of the golem package, Colin Fay.",Shiny,Learning Resource,"Eric Nantz,Colin Fay",,golem,https://shinydevseries.com/post/golem-demo/,,https://raw.githubusercontent.com/rfortherestofus/rru-website/master/plots/hands-on-demonstration-of-golem.png,plots/hands-on-demonstration-of-golem.png
golem,"""golem is an opinionated framework for building production-grade shiny applications.""",Shiny,Learning Resource,"Colin Fay,Vincent Guyader.,Sébastien Rochette,Cervan Girard",,shiny,https://thinkr-open.github.io/golem/index.html,https://engineering-shiny.org/img/thinkr-hex-golem2.png,https://raw.githubusercontent.com/rfortherestofus/rru-website/master/plots/golem.png,plots/golem.png
Engineering Production-Grade Shiny Apps,This book is a resource on building high-quality Shiny apps.,Shiny,Learning Resource,"Colin Fay,Vincent Guyader.,Sébastien Rochette,Cervan Girard",,"shiny,golem",https://engineering-shiny.org/index.html,,https://raw.githubusercontent.com/rfortherestofus/rru-website/master/plots/engineering-production-grade-shiny-apps.png,plots/engineering-production-grade-shiny-apps.png
shinybulma,A Shiny theme and extensions based on the Bulma CSS framework.,Shiny,Package,"John Coene,David Granjon",Shiny Themes,shiny,https://rinterface.github.io/shinybulma/,http://rinterface.com/inst/images/shinybulma.svg,https://raw.githubusercontent.com/rfortherestofus/rru-website/master/plots/shinybulma.png,plots/shinybulma.png
tablerDash,ler dashboard template for shiny with Bootstrap 4,Shiny,Package,David Granjon,Shiny Themes,shiny,https://rinterface.github.io/tablerDash/index.html,https://rinterface.github.io/tablerDash/reference/figures/tablerDash_demo.png,https://raw.githubusercontent.com/rfortherestofus/rru-website/master/plots/tabler-dash.png,plots/tabler-dash.png
shinydashboardPlus,"Provides extensions for Shiny dashboards, including sidebars, preloaders, and more.",Shiny,Package,David Granjon,Shiny Themes,shiny,https://rinterface.github.io/shinydashboardPlus/index.html,https://rinterface.github.io/shinydashboardPlus/reference/figures/shinydashPlus_demo.png,https://raw.githubusercontent.com/rfortherestofus/rru-website/master/plots/shinydashboard-plus.png,plots/shinydashboard-plus.png
shinyUIkit,"A wrapper of the UIKit framework for Shiny.
",Shiny,Package,David Granjon,Shiny Themes,shiny,https://rinterface.github.io/shinyUIkit/index.html,https://rinterface.github.io/shinyUIkit/reference/figures/UIkit_hex.svg,https://raw.githubusercontent.com/rfortherestofus/rru-website/master/plots/shiny-u-ikit.png,plots/shiny-u-ikit.png
Gentelella Shiny,An R Shiny HTML Template version of the gentelella bootstrap theme.,Shiny,Package,Mark Edmonson,Shiny Themes,shiny,http://code.markedmondson.me/gentelellaShiny/,https://github.com/MarkEdmondson1234/gentelellaShiny_nopackage/raw/master/gentellelaShinydemo.png,https://raw.githubusercontent.com/rfortherestofus/rru-website/master/plots/gentelella-shiny.png,plots/gentelella-shiny.png
shinymaterial,"An application of material design in Shiny.
",Shiny,Package,Eric Anderson,Shiny Themes,shiny,https://ericrayanderson.github.io/shinymaterial/,,https://raw.githubusercontent.com/rfortherestofus/rru-website/master/plots/shinymaterial.png,plots/shinymaterial.png
shiny.semantic,"""With this library it is easy to wrap Shiny with Fomantic UI (previously Semantic). Add a few simple lines of code to give your UI a fresh, modern and highly interactive look.""",Shiny,Package,"Filip Stachura,Dominik Krzeminski,Krystian Igras,Adam Forys,Paweł Przytuła",Shiny Themes,shiny,https://appsilon.github.io/shiny.semantic/,https://appsilon.github.io/shiny.semantic/reference/figures/churn.png,https://raw.githubusercontent.com/rfortherestofus/rru-website/master/plots/shiny-semantic.png,plots/shiny-semantic.png
shinyWidgets,"""This package offers custom widgets and other components to enhance your shiny applications. You can replace classical checkboxes with switch button, add colors to radio buttons and checkbox group, use buttons as radio or checkboxes. Each widget has an update method to change the value of an input from the server.""",Shiny,Package,"Victor Perrier,Fanny Meyer,David Granjon",Shiny Themes,shiny,http://shinyapps.dreamrs.fr/shinyWidgets/,,https://raw.githubusercontent.com/rfortherestofus/rru-website/master/plots/shiny-widgets.png,plots/shiny-widgets.png
argonDash,"A Shiny theme based on the argon framework.
",Shiny,Package,David Granjon,Shiny Themes,shiny,https://rinterface.github.io/argonDash/,https://rinterface.github.io/argonDash/reference/figures/argonDashDemo_horizontal.png,https://raw.githubusercontent.com/rfortherestofus/rru-website/master/plots/argon-dash.png,plots/argon-dash.png
bs4Dash,Bootstrap 4 shinydashboard using AdminLTE3,Shiny,Package,David Granjon,Shiny Themes,shiny,https://rinterface.github.io/bs4Dash/,https://community.rstudio.com/uploads/default/original/2X/e/eb1013fd09ccf10cbe13da3f0168eebfcb0eba75.gif,https://raw.githubusercontent.com/rfortherestofus/rru-website/master/plots/bs4dash.png,plots/bs4dash.png
bsplus,A collection of UI elements for Shiny.,Shiny,Package,Ian Lyttle,Shiny Themes,shiny,https://ijlyttle.github.io/bsplus/index.html,,https://raw.githubusercontent.com/rfortherestofus/rru-website/master/plots/bsplus.png,plots/bsplus.png
yonder,"""yonder is designed to make building pragmatic applications fun and rewarding. On the UI side yonder features new reactive inputs such as navInput(), chipInput() and menuInput(), as well as the latest Bootstrap components. On the server side yonder includes tools for showing alerts and toasts, displaying modal and popovers, hiding and showing panes of content, and more!""",Shiny,Package,Nathan Teetor,Shiny Themes,shiny,https://nteetor.github.io/yonder/,https://nteetor.github.io/yonder/reference/figures/logo.png,https://raw.githubusercontent.com/rfortherestofus/rru-website/master/plots/yonder.png,plots/yonder.png
Working with Strings in R: Seattle Pet Names,A tutorial giving examples of working with strings using the `stringr` package.,Strings,Learning Resource,Hugo Toscano,,stringr,https://toscano84.github.io/2019/04/working-with-strings-in-r-seattle-pet-names/,,https://raw.githubusercontent.com/rfortherestofus/rru-website/master/plots/working-with-strings-in-r-seattle-pet-names.png,plots/working-with-strings-in-r-seattle-pet-names.png
The tidyverse style guide,A style guide for the tidyverse.,Style Guides,Learning Resource,Hadley Wickham,,tidyverse,https://style.tidyverse.org/,,https://raw.githubusercontent.com/rfortherestofus/rru-website/master/plots/the-tidyverse-style-guide.png,plots/the-tidyverse-style-guide.png
JEFworks Lab style guide,A style guide developed by JEFworks Lab.,Style Guides,Learning Resource,JEFworks Lab,,,http://jef.works/R-style-guide/,,https://raw.githubusercontent.com/rfortherestofus/rru-website/master/plots/je-fworks-lab-style-guide.png,plots/je-fworks-lab-style-guide.png
RStudio Projects and Working Directories: A Beginner's Guide,A guide to working with RStudio projects.,Workflow,Learning Resource,Martin Chan,,,https://martinctc.github.io/blog/rstudio-projects-and-working-directories-a-beginner's-guide/,,https://raw.githubusercontent.com/rfortherestofus/rru-website/master/plots/r-studio-projects-and-working-directories-a-beginners-guide.png,plots/r-studio-projects-and-working-directories-a-beginners-guide.png
Project-oriented workflow,This article explains the value of using RStudio projects to make your work reproducible.,Workflow,Learning Resource,Jenny Bryan,,,https://www.tidyverse.org/blog/2017/12/workflow-vs-script/,,https://raw.githubusercontent.com/rfortherestofus/rru-website/master/plots/project-oriented-workflow.png,plots/project-oriented-workflow.png
Efficient R Programming,"""There are many excellent R resources for visualization, data science, and package development. Hundreds of scattered vignettes, web pages, and forums explain how to use R in particular domains. But little has been written on how to simply make R work effectively—until now. This hands-on book teaches novices and experienced R users how to write efficient R code. Drawing on years of experience teaching R courses, authors Colin Gillespie and Robin Lovelace provide practical advice on a range of topics—from optimizing the set-up of RStudio to leveraging C++—that make this book a useful addition to any R user’s bookshelf.""",Workflow,Learning Resource,"Colin Gillespie,Robin Lovelace",,,https://csgillespie.github.io/efficientR/,https://csgillespie.github.io/efficientR/figures/f0_web.png,https://raw.githubusercontent.com/rfortherestofus/rru-website/master/plots/efficient-r-programming.png,plots/efficient-r-programming.png
How Do You Organise Your R Project? This Is What We Do.,"""The Biometrics group at Telethon Kids Institute uses a standardised template project directory to manage our biostatistical consultation projects. This approach allows us to streamline our workflow, initiate projects, and produce professional looking reports directly from the statistical analysis platform minimising the time spent on the non-analytical aspects of our projects. This project structure is identical and successful for both simple and large-scale projects.""",Workflow,Learning Resource,Paul Stevenson,,,https://telethonkids.wordpress.com/2019/07/24/how-do-you-organise-your-r-project-this-is-what-we-do/,,https://raw.githubusercontent.com/rfortherestofus/rru-website/master/plots/how-do-you-organise-your-r-project-this-is-what-we-do.png,plots/how-do-you-organise-your-r-project-this-is-what-we-do.png
R Best Practices,"""When learning to write code for research projects, it can be overwhelming to figure out how to set-up a project and the novice programmer may not yet have the experience necessary to forsee potential pitfalls of a given, seemingly inconsequential decision. This post provides a discussion of best practices for developing code-based projects and for writing R code in a research setting with an eye toward proactively avoiding common pitfalls.""",Workflow,Learning Resource,Krista DeStasio,,,https://kdestasio.github.io/post/r_best_practices/,,https://raw.githubusercontent.com/rfortherestofus/rru-website/master/plots/r-best-practices.png,plots/r-best-practices.png
