title,description,category,type,creator_s,collection,related_resource,url,logo,featured_image,filename
xaringanthemer,A package to help you give your xaringan slides some style without (much) CSS.,Slides,Package,Garrick Aden-Buie,xaringan,xaringan,https://pkg.garrickadenbuie.com/xaringanthemer/,https://pkg.garrickadenbuie.com/xaringanthemer/reference/figures/logo.png,https://raw.githubusercontent.com/rfortherestofus/rru-website/master/plots/xaringanthemer.png,plots/xaringanthemer.png
R’s Killer Feature: RMarkdown,This blog post walks through what RMarkdown is and why it's valuable.,RMarkdown,Learning Resource,David Keyes,,RMarkdown,https://rfortherestofus.com/2019/03/r-killer-feature-rmarkdown/,,https://raw.githubusercontent.com/rfortherestofus/rru-website/master/plots/r-s-killer-feature-r-markdown.png,plots/r-s-killer-feature-r-markdown.png
gluedown,"The goal of gluedown is to ease the transition from R’s powerful vectors to formatted markdown text. Practically speaking, this means you can do things like convert vectors into bulleted lists in documents knitted from RMarkdown.",RMarkdown,Package,Kiernan Nicholls,,RMarkdown,https://kiernann.com/gluedown/,https://kiernann.com/gluedown/reference/figures/logo.png,https://raw.githubusercontent.com/rfortherestofus/rru-website/master/plots/gluedown.png,plots/gluedown.png
RMarkdown,"RMarkdown is a tool to help you go from data import to final report, all without leaving R.
",RMarkdown,Package,"JJ Allaire,Yihui Xie,Jonathan McPherson,Javier Luraschi,Kevin Ushey,Hadley Wickham,Aron Atkins,Joe Cheng,Winston Chang, Richard Iannone",,,https://rmarkdown.rstudio.com/docs/index.html,https://bookdown.org/yihui/rmarkdown/images/hex-rmarkdown.png,https://raw.githubusercontent.com/rfortherestofus/rru-website/master/plots/r-markdown.png,plots/r-markdown.png
RStudio Cloud Primer: Iterate,"A tutorial to help you ""master a core programming paradigm with the purrr package: for each ____ do ____.""",Iteration,Learning Resource,RStudio,,purrr,https://rstudio.cloud/learn/primers/5,https://rstudio.cloud/images/primers/thumb-iterate.svg,https://raw.githubusercontent.com/rfortherestofus/rru-website/master/plots/r-studio-cloud-primer-iterate.png,plots/r-studio-cloud-primer-iterate.png
How to Make Functions in R,"This post, complete with a video, shows how to make your own functions.",Functions,Learning Resource,David Keyes,,,https://rfortherestofus.com/2019/10/how-to-make-functions-in-r/,,https://raw.githubusercontent.com/rfortherestofus/rru-website/master/plots/how-to-make-functions-in-r.png,plots/how-to-make-functions-in-r.png
R for Data Science: Chapter 19: Functions,"This chapter from R for Data Science goes over how functions work, and how to create your own.",Functions,Learning Resource,"Hadley Wickham,Garrett Grolmund",,,https://r4ds.had.co.nz/functions.html,,https://raw.githubusercontent.com/rfortherestofus/rru-website/master/plots/r-for-data-science-chapter-19-functions.png,plots/r-for-data-science-chapter-19-functions.png
RStudio Cloud Primer: Functions,"A tutorial that will ""teach you how to write and use your own reusable functions.""",Functions,Learning Resource,RStudio,,,https://rstudio.cloud/learn/primers/6,https://rstudio.cloud/images/primers/thumb4.svg,https://raw.githubusercontent.com/rfortherestofus/rru-website/master/plots/r-studio-cloud-primer-functions.png,plots/r-studio-cloud-primer-functions.png
Stat545: Chapters 18-20: Write your own functions,"These chapters cover how functions work, and how to write your own.",Functions,Learning Resource,Jenny Bryan,,,https://stat545.com/functions-part1.html,,https://raw.githubusercontent.com/rfortherestofus/rru-website/master/plots/stat545-chapters-18-20-write-your-own-functions.png,plots/stat545-chapters-18-20-write-your-own-functions.png
Using the tidyverse with Databases,The first in a three-part series of connecting to databases from R.,Databases,Learning Resource,Vebash Naidoo,,"dbplyr,dplyr,RSQLite,DBI",https://sciencificity-blog.netlify.app/posts/2020-12-12-using-the-tidyverse-with-databases/,,https://raw.githubusercontent.com/rfortherestofus/rru-website/master/plots/using-the-tidyverse-with-databases.png,plots/using-the-tidyverse-with-databases.png
DBI,The DBI package helps connecting R to database management systems (DBMS). DBI separates the connectivity to the DBMS into a “front-end” and a “back-end.”,Databases,Package,"Kirill Müller,Hadley Wickham",,,https://dbi.r-dbi.org/,,https://raw.githubusercontent.com/rfortherestofus/rru-website/master/plots/dbi.png,plots/dbi.png
dbplyr,"""dbplyr is the database backend for dplyr. It allows you to use remote database tables as if they are in-memory data frames by automatically converting dplyr code into SQL.""",Databases,Package,"Hadley Wickham,Maximilian Girlich,Edgar Ruiz",,,https://dbplyr.tidyverse.org/,https://github.com/tidyverse/dbplyr/raw/master/man/figures/logo.png,https://raw.githubusercontent.com/rfortherestofus/rru-website/master/plots/dbplyr.png,plots/dbplyr.png
RSQLite,"This package ""embeds the SQLite database engine in R, providing a DBI-compliant interface. SQLite is a public-domain, single-user, very light-weight database engine that implements a decent subset of the SQL 92 standard, including the core table creation, updating, insertion, and selection operations, plus transaction management.""",Databases,Package,"Kirill Müller,Hadley Wickham,David James,Seth Falcon",,,https://rsqlite.r-dbi.org/,,https://raw.githubusercontent.com/rfortherestofus/rru-website/master/plots/rsq-lite.png,plots/rsq-lite.png
30 Day Map Challenge,"In 2019, Bob Rudis participated in the 30 Day Map Challenge. This bookdown project details how he did it, complete with code examples used to make a wide range of maps.",Mapping/Geospatial,Learning Resource,Bob Rudis,,,https://rud.is/books/30-day-map-challenge/,,https://raw.githubusercontent.com/rfortherestofus/rru-website/master/plots/x30-day-map-challenge.png,plots/x30-day-map-challenge.png
An Exploration of Simple Features for R,"This blog post is a great introduction to simple features, the data type often used to make maps in R with the sf package.",Mapping/Geospatial,Learning Resource,Jesse Sadler,,sf,https://www.jessesadler.com/post/simple-feature-objects/,,https://raw.githubusercontent.com/rfortherestofus/rru-website/master/plots/an-exploration-of-simple-features-for-r.png,plots/an-exploration-of-simple-features-for-r.png
An Exploration of Simple Features for R,"This 2018 blog post is an overview of how get started making maps in R. Although it introduces both the sf and sp packages, most people have moved to using just the sf package.",Mapping/Geospatial,Learning Resource,Jesse Sadler,,sf,https://www.jessesadler.com/post/gis-with-r-intro/,,https://raw.githubusercontent.com/rfortherestofus/rru-website/master/plots/an-exploration-of-simple-features-for-r_2.png,plots/an-exploration-of-simple-features-for-r_2.png
biscale,"This package makes bivariate maps in R. From the package vignette: ""Thematic choropleth maps are used to display quantities of some variable within areas, such as mapping median income across a city’s neighborhoods. However, we often think in bivariate terms - “how do race and income vary together?”."" Maps that captures this, known as bivariate choropleth maps, are often perceived as difficult to create and interpret. The goal of biscale is to implement a consistent approach to bivariate mapping entirely within R.",Mapping/Geospatial,Package,Chris Prenner,,sf,https://slu-opengis.github.io/biscale/,https://slu-opengis.github.io/biscale/reference/figures/logo.png,https://raw.githubusercontent.com/rfortherestofus/rru-website/master/plots/biscale.png,plots/biscale.png
Space lesson from Data Visualization course,"This lesson from Andrew Heiss's data visualization course covers the basics of working with geospatial data and making maps in R.
",Mapping/Geospatial,Learning Resource,Andrew Heiss,,"sf,ggplot2",https://datavizm20.classes.andrewheiss.com/example/12-example/,,https://raw.githubusercontent.com/rfortherestofus/rru-website/master/plots/space-lesson-from-data-visualization-course.png,plots/space-lesson-from-data-visualization-course.png
Data Visualization,"A collection of materials from this course that helps you to ""use R, ggplot2, and the principles of graphic design to create beautiful and truthful visualizations of data.""",Data Visualization,Learning Resource,Andrew Heiss,Course Materials,ggplot2,https://datavizm20.classes.andrewheiss.com/,,https://raw.githubusercontent.com/rfortherestofus/rru-website/master/plots/data-visualization.png,plots/data-visualization.png
statebins,"This package makes states into equally-spaced squares, making it easier to demonstrates patterns across them.
",Mapping/Geospatial,Package,Bob Rudis,,,https://github.com/hrbrmstr/statebins,https://github.com/hrbrmstr/statebins/raw/master/man/figures/README-original-1.png,https://raw.githubusercontent.com/rfortherestofus/rru-website/master/plots/statebins.png,plots/statebins.png
Introduction to Geospatial Raster and Vector Data with R,"""The episodes in this lesson cover how to open, work with, and plot vector and raster-format spatial data in R. Additional topics include working with spatial metadata (extent and coordinate reference systems), reprojecting spatial data, and working with raster time series data.""",Mapping/Geospatial,Learning Resource,"Leah Wasser,Megan Jones,Zack Brym,Kristina Riemer,Jason Williams,Jeff Hollister,Mike Smorul,Joseph Stachelek",Course Materials,"sf,raster",https://datacarpentry.org/r-raster-vector-geospatial/,,https://raw.githubusercontent.com/rfortherestofus/rru-website/master/plots/introduction-to-geospatial-raster-and-vector-data-with-r.png,plots/introduction-to-geospatial-raster-and-vector-data-with-r.png
Introduction to mapping with {sf} & Co.,"This blog post is an introduction to using the sf package to make maps.
",Mapping/Geospatial,Learning Resource,Sébastien Rochette,,sf,https://statnmap.com/2018-07-14-introduction-to-mapping-with-sf-and-co/,,https://raw.githubusercontent.com/rfortherestofus/rru-website/master/plots/introduction-to-mapping-with-sf-co.png,plots/introduction-to-mapping-with-sf-co.png
leaidr,The goal of leaidr is to provide an easy way to map U.S. school districts in R.,Mapping/Geospatial,Package,Isabella Velásquez,,"sf,ggplot2",https://github.com/ivelasq/leaidr,https://github.com/ivelasq/leaidr/raw/master/man/figures/logo.png,https://raw.githubusercontent.com/rfortherestofus/rru-website/master/plots/leaidr.png,plots/leaidr.png
sf cheatsheet,Cheatsheet for the sf package.,Mapping/Geospatial,Learning Resource,RStudio,,sf,https://github.com/rstudio/cheatsheets/blob/master/sf.pdf,,https://raw.githubusercontent.com/rfortherestofus/rru-website/master/plots/sf-cheatsheet.png,plots/sf-cheatsheet.png
sf: A Tutorial,"This tutorials covers the sf package, which ""provides a powerful interface for R users to work with geospatial data stored in vector formats.""",Mapping/Geospatial,Learning Resource,Daryn Ramsden,,sf,https://thisisdaryn.shinyapps.io/tutorial_sf/#section-introduction,,https://raw.githubusercontent.com/rfortherestofus/rru-website/master/plots/sf-a-tutorial.png,plots/sf-a-tutorial.png
Spatial Data Science,"""This book introduces and explains the concepts underlying spatial data: points, lines, polygons, rasters, coverages, geometry attributes, data cubes, reference systems, as well as higher-level concepts including how attributes relate to geometries and how this affects analysis.""",Mapping/Geospatial,Learning Resource,"Edzer Pebesma,Roger Bivand",,"sf,raster,stars",https://keen-swartz-3146c4.netlify.app/,,https://raw.githubusercontent.com/rfortherestofus/rru-website/master/plots/spatial-data-science.png,plots/spatial-data-science.png
stars,"This package works with ""spatiotemporal data [that] often comes in the form of dense arrays, with space and time being array dimensions.""
",Mapping/Geospatial,Package,Edzer Pebesma,,,https://r-spatial.github.io/stars/,https://raw.githubusercontent.com/r-spatial/stars/master/images/cube1.png,https://raw.githubusercontent.com/rfortherestofus/rru-website/master/plots/stars.png,plots/stars.png
tidygeocoder,"Tidygeocoder makes getting data from geocoder services easy by using several geocoding services (U.S. Census Bureau, Open Street Map, Geocodio, Location IQ, and Google).",Mapping/Geospatial,Package,"Jesse Cambon,Christopher Belanger",,,https://jessecambon.github.io/tidygeocoder/index.html,https://jessecambon.github.io/tidygeocoder/reference/figures/tidygeocoder_hex.png,https://raw.githubusercontent.com/rfortherestofus/rru-website/master/plots/tidygeocoder.png,plots/tidygeocoder.png
urbanmapr,The urbnmapr package provides U.S. state and county shapefiles that are compatible to map with ggplot2.,Mapping/Geospatial,Package,"Sarah Strochak,Kyle Ueyama,Aaron Williams",,,https://urbaninstitute.github.io/urbnmapr/index.html,https://urbaninstitute.github.io/urbnmapr/reference/figures/hexsticker.png,https://raw.githubusercontent.com/rfortherestofus/rru-website/master/plots/urbanmapr.png,plots/urbanmapr.png
useR! 2020 workshop on spatial data handling and visualization,"This is a video recording of a workshop on spatial data handling and visualization.
",Mapping/Geospatial,Learning Resource,"Sébastien Rochette,Jakub Nowosad,Dorris Scott",,sf,https://www.youtube.com/watch?v=1Hp8MO82t4g,,https://raw.githubusercontent.com/rfortherestofus/rru-website/master/plots/use-r-2020-workshop-on-spatial-data-handling-and-visualization.png,plots/use-r-2020-workshop-on-spatial-data-handling-and-visualization.png
hrbrthemes,"This package ""provides typography-centric themes and theme components for ggplot2.""","Data Visualization,ggplot Themes",Package,Bob Rudis,,ggplot2,https://cinc.rud.is/web/packages/hrbrthemes/,https://github.com/hrbrmstr/hrbrthemes/raw/master/man/figures/README-an-1.png,https://raw.githubusercontent.com/rfortherestofus/rru-website/master/plots/hrbrthemes.png,plots/hrbrthemes.png
firatheme,A ggplot2 theme using the fira font.,"Data Visualization,ggplot Themes",Package,Erik-Jan van Kesteren,,ggplot2,https://github.com/vankesteren/firatheme,https://github.com/vankesteren/firatheme/raw/master/img/plot.png,https://raw.githubusercontent.com/rfortherestofus/rru-website/master/plots/firatheme.png,plots/firatheme.png
ggthemes,"Jeffrey Arnold’s ggthemes package is a collection of themes, including themes that replicate the look and feel of the Economist and FiveThirtyEight, among others.
","Data Visualization,ggplot Themes",Package,Jeffrey Arnold,,ggplot2,https://jrnold.github.io/ggthemes/,https://mk0rfortheresto0o08q.kinstacdn.com/wp-content/uploads/2019/08/theme_fivethirtyeight-1-1024x633.png,https://raw.githubusercontent.com/rfortherestofus/rru-website/master/plots/ggthemes.png,plots/ggthemes.png
ggthemr,"This package is designed to enable you to set defaults for your plot themes and have these defaults apply throughout your work.
","Data Visualization,ggplot Themes",Package,Ciarán Tobin,,ggplot2,https://github.com/Mikata-Project/ggthemr,https://github.com/Mikata-Project/ggthemr/raw/master/README_files/figure-markdown_github/unnamed-chunk-12-1.png,https://raw.githubusercontent.com/rfortherestofus/rru-website/master/plots/ggthemr.png,plots/ggthemr.png
ggtech,"A collection of themes designed to make your plots have the look and feel of various tech companies.
","Data Visualization,ggplot Themes",Package,Ricardo Bion,,ggplot2,https://github.com/ricardo-bion/ggtech,https://github.com/ricardo-bion/ggtech/raw/master/README_files/figure-html/unnamed-chunk-3-1.png,https://raw.githubusercontent.com/rfortherestofus/rru-website/master/plots/ggtech.png,plots/ggtech.png
urbnthemes,"""urbnthemes is a set of tools for creating Urban Institute-themed plots and maps in R. The package extends ggplot2 with print and map themes as well as tools that make plotting easier at the Urban Institute.""","Data Visualization,ggplot Themes",Package,"Aaron Williams,Kyle Ueyama,Ben Chartoff",,ggplot2,https://urbaninstitute.github.io/urbnthemes/index.html,https://urbaninstitute.github.io/urbnthemes/reference/figures/hexsticker.png,https://raw.githubusercontent.com/rfortherestofus/rru-website/master/plots/urbnthemes.png,plots/urbnthemes.png
bbplot,"""R package that helps create and export ggplot2 charts in the style used by the BBC News data team.""","Data Visualization,ggplot Themes",Package,"Nassos Stylianou,Clara Guibourg",,ggplot2,https://github.com/bbc/bbplot/,https://github.com/bbc/bbplot/raw/master/chart_examples/bbplot_example_plots.png,https://raw.githubusercontent.com/rfortherestofus/rru-website/master/plots/bbplot.png,plots/bbplot.png
ggpomological,This package gives your figures a watercolor-type look.,"Data Visualization,ggplot Themes",Package,Garrick Aden-Buie,,ggplot2,https://www.garrickadenbuie.com/project/ggpomological/,https://www.garrickadenbuie.com/images/project/ggpomological/ggpomological.png,https://raw.githubusercontent.com/rfortherestofus/rru-website/master/plots/ggpomological.png,plots/ggpomological.png
tvthemes,"The tvthemes package is a collection of various ggplot2 themes and color/fill palettes based on various TV shows.

","Data Visualization,ggplot Themes",Package,Ryo Nakagawara,,ggplot2,https://ryo-n7.github.io/tvthemes/,https://i.imgur.com/NUjriiF.png,https://raw.githubusercontent.com/rfortherestofus/rru-website/master/plots/tvthemes.png,plots/tvthemes.png
artyfarty,A collection of ggplot themes.,"Data Visualization,ggplot Themes",Package,Bart Smeets,,ggplot2,https://datarootsio.github.io/artyfarty/articles/introduction.html,https://datarootsio.github.io/artyfarty/articles/introduction_files/figure-html/unnamed-chunk-4-1.png,https://raw.githubusercontent.com/rfortherestofus/rru-website/master/plots/artyfarty.png,plots/artyfarty.png
No Limits!,Slides from a presentation on making your own custom ggplot theme.,"Data Visualization,ggplot Themes",Learning Resource,Mike Moore,,ggplot2,https://mikemooreviz.github.io/nolimits/#1,,https://raw.githubusercontent.com/rfortherestofus/rru-website/master/plots/no-limits.png,plots/no-limits.png
Collaborating with git and GitHub,This chapter from a larger set of course materials covers the basics of Git and GitHub.,Git/GitHub,Learning Resource,"Daniel Anderson,Brendan Cullen,Ouafaa Hmaddi",Course Materials,,https://www.sds.pub/collaborating-with-git-and-github.html,,https://raw.githubusercontent.com/rfortherestofus/rru-website/master/plots/collaborating-with-git-and-git-hub.png,plots/collaborating-with-git-and-git-hub.png
Introduction to Open Data Science: GitHub,This chapter from a larger set of course materials covers the basics of Git and GitHub.,Git/GitHub,Learning Resource,The Ocean Health Index Team,Course Materials,,http://ohi-science.org/data-science-training/github.html,,https://raw.githubusercontent.com/rfortherestofus/rru-website/master/plots/introduction-to-open-data-science-git-hub.png,plots/introduction-to-open-data-science-git-hub.png
R for Excel Users: GitHub,"These materials, from a 2019 rstudio::conf workshop titled ""R for Excel Users"" cover ""version control and practice a workflow with GitHub and RStudio that streamlines working with our most important collaborator: Future You.""
",Git/GitHub,Learning Resource,"Julia Lowndes,Allison Horst",,,https://rstudio-conf-2020.github.io/r-for-excel/github.html,,https://raw.githubusercontent.com/rfortherestofus/rru-website/master/plots/r-for-excel-users-git-hub.png,plots/r-for-excel-users-git-hub.png
Git for Humans,"This 2016 presentation breaks down Git/GitHub into concepts that make sense for ""normal"" humans. <a href=""https://speakerdeck.com/alicebartlett/git-for-humans"">Associated slides are also available</a>.",Git/GitHub,Learning Resource,Alice Bartlett,,,https://www.youtube.com/watch?v=eWxxfttcMts,,https://raw.githubusercontent.com/rfortherestofus/rru-website/master/plots/git-for-humans.png,plots/git-for-humans.png
Happy Git with R,This book is an extremely comprehensive guide to using Git and GitHub along with R.,Git/GitHub,Learning Resource,"Jenny Bryan,Jim Hester",,,https://happygitwithr.com/,,https://raw.githubusercontent.com/rfortherestofus/rru-website/master/plots/happy-git-with-r.png,plots/happy-git-with-r.png
The complete guide to scales,"This websites shows all of the scales (color, fill, size, etc) that are available in ggplot2.",Data Visualization,Learning Resource,Christian Burkhart,,ggplot2,https://ggplot2tor.com/scales/,,https://raw.githubusercontent.com/rfortherestofus/rru-website/master/plots/the-complete-guide-to-scales.png,plots/the-complete-guide-to-scales.png
R for Journalists,Course materials providing a general overview of R for journalists.,"Data Import,Data Wrangling,Data Visualization,Mapping/Geospatial",Learning Resource,Andrew Ba Tran,Course Materials,,https://learn.r-journalism.com/en/,,https://raw.githubusercontent.com/rfortherestofus/rru-website/master/plots/r-for-journalists.png,plots/r-for-journalists.png
"The power of three: purrr-poseful iteration in R with map, pmap and imap","This blog post gives examples of several functions from the `purrr` package to help you with iteration.
",Iteration,Learning Resource,Zev Ross,,purrr,https://www.zevross.com/blog/2019/06/11/the-power-of-three-purrr-poseful-iteration-in-r-with-map-pmap-and-imap/,,https://raw.githubusercontent.com/rfortherestofus/rru-website/master/plots/the-power-of-three-purrr-poseful-iteration-in-r-with-map-pmap-and-imap.png,plots/the-power-of-three-purrr-poseful-iteration-in-r-with-map-pmap-and-imap.png
Learn to purrr,"""Purrr is the tidyverse's answer to apply functions for iteration. It's one of those packages that you might have heard of, but seemed too complicated to sit down and learn. Starting with map functions, and taking you on a journey that will harness the power of the list, this post will have you purrring in no time.""",Iteration,Learning Resource,Rebecca Barter,,purrr,http://www.rebeccabarter.com/blog/2019-08-19_purrr/,,https://raw.githubusercontent.com/rfortherestofus/rru-website/master/plots/learn-to-purrr.png,plots/learn-to-purrr.png
reactablefmtr,An R package to simplify formatting and customization of tables made with {reactable},Tables,Package,Kyle Cuilla,,reactable,https://github.com/kcuilla/reactablefmtr,,https://raw.githubusercontent.com/rfortherestofus/rru-website/master/plots/reactablefmtr.png,plots/reactablefmtr.png
tidyexplain,"This project provides a series of animations to show how various `dplyr` joins work.
",Data Merging,Learning Resource,Garrick Aden-Buie,,dplyr,https://www.garrickadenbuie.com/project/tidyexplain/,,https://raw.githubusercontent.com/rfortherestofus/rru-website/master/plots/tidyexplain.png,plots/tidyexplain.png
Your first R package in 1 hour,"""This blog post accompanies the R-Ladies Philly workshop on November 12, 2020. We demonstrate how leveraging the devtools and usethis packages in package development can automate folder structure and file creation, speeding up the development process.""
",Package Development,Learning Resource,Shannon Pileggi,,"usethis,devtools",https://www.pipinghotdata.com/posts/2020-10-25-your-first-r-package-in-1-hour/,,https://raw.githubusercontent.com/rfortherestofus/rru-website/master/plots/your-first-r-package-in-1-hour.png,plots/your-first-r-package-in-1-hour.png
devtools,"`devtools` is an R package designed to ease the process of developing your own packages.
",Package Development,Package,"Hadley Wickham,Jim Hester,Winston Chang",,,https://devtools.r-lib.org/index.html,https://devtools.r-lib.org/reference/figures/logo.svg,https://raw.githubusercontent.com/rfortherestofus/rru-website/master/plots/devtools.png,plots/devtools.png
The R Package Worflow,"This blog post discusses the idea of developing every analysis project as a package. In the process, it gives an overview of how package development works.
",Package Development,Learning Resource,David Neuzerling,,,https://mdneuzerling.com/post/data-science-workflows/,,https://raw.githubusercontent.com/rfortherestofus/rru-website/master/plots/the-r-package-worflow.png,plots/the-r-package-worflow.png
How to write your own R package and publish it on CRAN,"""While there exist many great resources for learning how to write a package in R, we found it difficult to find one all-encompassing guide that is also easily accessible for beginners. This tutorial seeks to close this gap: we will provide you with a step-by-step guide — seasoned with new and helpful packages ...""
",Package Development,Learning Resource,Cosima Meyer,,,https://www.mzes.uni-mannheim.de/socialsciencedatalab/article/r-package/,,https://raw.githubusercontent.com/rfortherestofus/rru-website/master/plots/how-to-write-your-own-r-package-and-publish-it-on-cran.png,plots/how-to-write-your-own-r-package-and-publish-it-on-cran.png
You're Already Ready: Zen and the Art of R Package Development,"This talk from rstudio::global 2021 seeks to show ""why your project is already an R package, why you’re already an R package developer, and why you already have the skills to walk the path of development.""",Package Development,Learning Resource,Malcolm Barrett,,,https://rstudio.com/resources/rstudioglobal-2021/youre-already-ready-zen-and-the-art-of-r-package-development/,,https://raw.githubusercontent.com/rfortherestofus/rru-website/master/plots/youre-already-ready-zen-and-the-art-of-r-package-development.png,plots/youre-already-ready-zen-and-the-art-of-r-package-development.png
